Kiniyota Espresso;95;Madison, Wisconsin;Buhinyuza District, Muhinga Province, Burundi;Medium Light;$17.60/12 ounces;54;78;5.17;45825;Burundi;Madison, Wisconsin;USA;
El Obraje Geisha;95;Boulder, Colorado;Narino Department, southern Colombia;Medium Light;$35.00/8 ounces;52;78;15.43;35;Colombia;Boulder, Colorado;USA;Colombia
Mandheling Onan Ganjang;94;Chia-Yi, Taiwan;Lintong growing region, North Sumatra Province, Indonesia;Medium Light;NT $550/16 ounces;55;77;121.25;550;Indonesia;Chia-Yi, Taiwan;Taiwan;Indonesia
Ethiopia Banko Gotiti Natural;94;Taipei, Taiwan;Yirgacheffe growing region, south-central Ethiopia;Light;NT $700/16 ounces;60;84;154.32;700;Ethiopia;Taipei, Taiwan;Taiwan;Ethiopia
Yemen Microlot;96;Boulder, Colorado;Yemen;Light;$75.00/8 ounces;58;84;33.07;75;Yemen;Boulder, Colorado;USA;Yemen
Lycello by Ninety Plus;95;Boulder, Colorado;Chiriqui Province, far western Panama;Medium Light;$75.00/8 ounces;54;78;33.07;75;Panama;Boulder, Colorado;USA;Panama
Lotus by Ninety Plus;95;Boulder, Colorado;Chiriqui Province, far western Panama;Medium Light;$145.00/8 ounces;52;72;63.93;145;Panama;Boulder, Colorado;USA;Panama
Karen J Red Bourbon;94;Holualoa, Hawaii;Holualoa, North Kona growing district, “Big Island” of Hawaii;Medium Light;$45.95/8 ounces;58;80;20.26;45.95;Hawaii;Holualoa, Hawaii;USA;United States
Kenya Nyeri Gatugi Peaberry;94;Ventura, California;Nyeri growing region, south-central Kenya;Medium;$17.95/12 ounces;45;75;5.28;17.95;Kenya;Ventura, California;USA;Kenya
Kenya Gura AA;94;Tainan, Taiwan;Central Kenya;Medium Light;NT $460/8 ounces;56;78;202.82;460;Kenya;Tainan, Taiwan;Taiwan;Kenya
Sumatra Tano Batak;94;Topeka, Kansas;Lintong growing region, North Sumatra Province, Indonesia;Medium Light;$21.00/12 ounces;53;77;6.17;21;Indonesia;Topeka, Kansas;USA;Indonesia
Sumatra Tano Batak;94;Bedford, New Hampshire;Lintong growing region, North Sumatra Province, Indonesia;Medium Light;$17.00/12 ounces;55;77;5;17;Indonesia;Bedford, New Hampshire;USA;Indonesia
Yemen Port of Mokha Al-Durrar;94;San Rafael, California;Al-Durrar, Sana’a Governorate, Yemen;Medium Light;$30.50/4 ounces;50;76;26.9;45807;Yemen;San Rafael, California;USA;Yemen
Finca La Maria Geisha Natural;95;San Diego, California;Cundinamarca Department, Colombia;Medium Light;$51.00/8 ounces;55;79;22.49;51;Colombia;San Diego, California;USA;Colombia
Ethiopia Guji Gigessa;94;Changhua County, Taiwan;Guji Zone, Oromia Region, south-central Ethiopia;Light;NT $460/8 ounces;60;84;202.82;460;Ethiopia;Changhua, Taiwan;Taiwan;Ethiopia
Granja La Esperanza Sudan Rume Natural;95;Topeka, Kansas;Valle del Cauca growing region, Colombia;Medium;$37.50/8 ounces;50;70;16.53;37.5;Colombia;Topeka, Kansas;USA;Colombia
Gedeb Espresso;94;Madison, Wisconsin;Gedeb District, Yirgacheffe growing region, south-central Ethiopia;Medium Light;$18.75/12 ounces;51;74;5.51;18.75;Ethiopia;Madison, Wisconsin;USA;Ethiopia
Panama Baru Geisha Honey by Joseph;94;Chia-Yi, Taiwan;Boquete growing region, western Panama;Medium Light;NT $900/8 ounces;56;78;396.83;900;Panama;Chia-Yi, Taiwan;Taiwan;Panama
Panama Baru Geisha Natural by Joseph;94;Chia-Yi, Taiwan;Boquete growing region, western Panama;Medium Light;NT $950/8 ounces;58;80;418.87;950;Panama;Chia-Yi, Taiwan;Taiwan;Panama
Burundi Buhorwa;94;Chicago, Illinois;Northern Burundi;Medium Light;$15.00/12 ounces;54;78;4.41;15;Burundi;Chicago, Illinois;USA;
Dodora Double;96;Lee, Massachusetts;Gedeo Zone, Yirgacheffe growing region, southern EthiopiaGedeo Zone, southern Ethiopia;Light;$9.94/4 ounces;60;84;8.77;34578;Ethiopia;Lee, Massachusetts;USA;Ethiopia
Summer Night Blend Espresso;94;Chia-Yi, Taiwan;Guatemala, Honduras, Ethiopia;Medium Light;NT $500/16 ounces;58;82;110.23;500;Ethiopia;Chia-Yi, Taiwan;Taiwan;Ethiopia
Kenya Kirinyaga;94;Chicago, Illinois;Kirinyaga District, south-central Kenya;Light;$15.00/12 ounces;65;91;4.41;15;Kenya;Chicago, Illinois;USA;Kenya
Sumatra Mutu Batak;94;Los Angeles, California;Lintong growing region, North Sumatra Province, Indonesia;Medium;$14.95/12 ounces;49;71;4.39;14.95;Indonesia;Los Angeles, California;USA;Indonesia
Three Queens Blend;94;Thornton, Colorado;Ethiopia, Burundi, Kenya;Medium Light;$13.99/12 ounces;52;73;4.11;13.99;Kenya;Thornton, Colorado;USA;Kenya
Kiniyota Burundi;95;Madison, Wisconsin;Buhinyuza District, Muhinga Province, Burundi;Medium Light;$17.60/12 ounces;52;78;5.17;45825;Burundi;Madison, Wisconsin;USA;
Kona Mocca®;95;Holualoa, Hawaii;Holualoa, North Kona growing district, “Big Island” of Hawaii;Medium;$44.95/8 ounces;46;62;19.82;44.95;Hawaii;Holualoa, Hawaii;USA;United States
Ethiopia Suke Quto Honey;94;Ramsey, Minnesota;Guji Zone, Oromia Region, south-central Ethiopia;Medium Light;$17.95/12 ounces;58;82;5.28;17.95;Ethiopia;Ramsey, Minnesota;USA;Ethiopia
Ethiopia Biftu Gundina Coop Espresso;94;Chia-Yi, Taiwan;Agaro District, Jimma Zone, west-central Ethiopia;Medium Dark;NT $550/16 ounces;42;57;121.25;550;Ethiopia;Chia-Yi, Taiwan;Taiwan;Ethiopia
Ethiopia Banko Gotiti Natural;94;Chia-Yi, Taiwan;Yirgacheffe growing region, south-central Ethiopia;Light;NT $650/16 ounces;60;88;143.3;650;Ethiopia;Chia-Yi, Taiwan;Taiwan;Ethiopia
Canoe Blend;94;Portland, Oregon;Central America, South America, Indonesia;Medium Light;$14.00/12 ounces;56;82;4.12;14;Indonesia;Portland, Oregon;USA;Indonesia
Guatemala Retiro Natural Process;94;Durango, Colorado;San Martin Jilotepeque, Chimaltenango Department, central Guatemala;Medium Light;$15.75/12 ounces;57;70;4.63;15.75;Guatemala;Durango, Colorado;USA;Guatemala
Kenya Gatugi AB;94;Taichung, Taiwan;Kenya Gatugi AB;Medium Light;$35.00/100 grams;53;85;35;1.234567901;;Taichung, Taiwan;Taiwan;
Gedeb Ethiopia;95;Madison, Wisconsin;Gedeb District, Gedeo Zone, southern Ethiopia;Medium Light;$18.75/12 ounces;58;82;5.51;18.75;Ethiopia;Madison, Wisconsin;USA;Ethiopia
Ethiopia Dry-Processed Guji Mt. Kayon;95;Taichung, Taiwan;Guji Zone, Oromia Region, south-central Ethiopia;Medium Light;$35.00/100 grams;56;75;35;1.234567901;Ethiopia;Taichung, Taiwan;Taiwan;Ethiopia
Ethiopia Banko Gotiti;94;Floyd, Virginia;Kochere, Yirgacheffe growing region, south-central Ethiopia;Light;$16.99/12 ounces;65;93;4.99;16.99;Ethiopia;Floyd, Virginia;USA;Ethiopia
Panama Auromar Estate Geisha Peaberry;95;San Diego, California;Piedra Candela, Chiriqui Province, far western Panama;Medium Light;$51.00/8 ounces;53;81;22.49;51;Panama;San Diego, California;USA;Panama
Panama Finca Hartmann Geisha Natural;95;Sacramento, California;Chiriqui Province, far western Panama;Light;$54.00/8 ounces;60;84;23.81;54;Panama;Sacramento, California;USA;Panama
Mini-Me Washed Kaffa Forest;95;Taoyuan City, Taiwan;Yirgacheffe growing region, southern Ethiopia;Medium Dark;NT $1300/16 ounces;40;60;286.6;1300;Ethiopia;Taoyuan, Taiwan;Taiwan;Ethiopia
Jade Espresso;94;Charlotte, North Carolina;Brazil and four other origins;Medium Light;$14.00/12 ounces;56;72;4.12;14;;Charlotte, North Carolina;USA;
Ulos Batak Sumatra;96;Madison, Wisconsin;Northern Sumatra, Indonesia;Medium Light;$18.95/12 ounces;54;76;5.57;18.95;Indonesia;Madison, Wisconsin;USA;Indonesia
Blue Label La Esmeralda Porton Pascua Gesha;95;Topeka, Kansas;Boquete growing region, western Panama;Medium Light;$60.00/8 ounces;53;85;26.46;60;Panama;Topeka, Kansas;USA;Panama
David Mburu Kenya;96;Portland, Oregon;Kiambu County, south-central Kenya;Light;$15.00/250 grams;58;84;6;0.529100529;Kenya;Portland, Oregon;USA;Kenya
El Peñon Nicaragua;94;Lee, Massachusetts;Jinotega, Nicaragua;Light;$17.95/12 ounces;61;93;5.28;17.95;Nicaragua;Lee, Massachusetts;USA;Nicaragua
Kenya Chorongi Peaberry;95;Portland, Maine;Mukaro, Nyeri growing region, south-central Kenya;Medium Light;$20.00/12 ounces;50;76;5.88;20;Kenya;Portland, Maine;USA;Kenya
Kenya Riakiberu AB;95;Montrose, Colorado;Muranga District, central Kenya;Medium Light;$14.00/250 grams;55;77;5.6;0.49382716;Kenya;Montrose, Colorado;USA;Kenya
Yule Blend 2018;94;Bedford, New Hampshire;Kirinyaga District, south-central Kenya;Medium Light;$15.00/12 ounces;56;80;4.41;15;Kenya;Bedford, New Hampshire;USA;Kenya
Kenya Thaitu;95;Louisville, Kentucky;Nakuru County, south-central Kenya;Medium Light;$22.00/12 ounces;54;78;6.47;22;Kenya;Louisville, Kentucky;USA;Kenya
Ethiopia Banko Gotiti Natural G1;94;Taipei, Taiwan;Kochere, Yirgacheffe growing region, south-central Ethiopia;Light;NT $580/220 grams;58;86;263.64;20.45855379;Ethiopia;Taipei, Taiwan;Taiwan;Ethiopia
Panama Auromar Geisha Natural;96;Branford, Connecticut;Piedra Candela, Chiriqui Province, far western Panama;Medium Light;$55.00/12 ounces;56;80;16.17;55;Panama;Branford, Connecticut;USA;Panama
El Salvador Finca Kilimanjaro;95;San Diego, California;Santa Ana Department, El Salvador;Medium Light;$25.00/12 ounces;56;80;7.35;25;Salvador;San Diego, California;USA;El Salvador
Panama Elida Green Tip Gesha Natural;94;San Rafael, California;Boquete growing region, western Panama;Medium Light;$37.00/4 ounces;53;77;32.63;37;Panama;San Rafael, California;USA;Panama
Gikanda Kenya;96;Madison, Wisconsin;South-central Kenya;Medium Light;$19.25/12 ounces;55;76;5.66;19.25;Kenya;Madison, Wisconsin;USA;Kenya
Panama Don Julian Pacamara;95;Branford, Connecticut;Horcheta, Chiriqui Province, western Panama;Medium Light;$49.99/16 ounces;56;80;11.02;49.99;Panama;Branford, Connecticut;USA;Panama
100% Kona Bourbon Pointu Laurina;95;Holualoa, Hawaii;Holualoa, North Kona growing district, “Big Island” of Hawaii;Medium Light;$44.95/8 ounces;52;76;19.82;44.95;Hawaii;Holualoa, Hawaii;USA;United States
Kenya AB Muchoki;95;Los Angeles, California;Nyeri growing region, south-central Kenya;Medium Light;$19.95/12 ounces;55;75;5.86;19.95;Kenya;Los Angeles, California;USA;Kenya
Geisha Panama Santamaria Natural;95;Newtown, Sydney, Australia;Paso Ancho, Volcan, western Panama;Medium Light;AUD $48.00/200 grams;54;78;24;;Panama;Newtown, Australia;Australia;Panama
100% Kona SL-28;97;Holualoa, Hawaii;Holualoa, North Kona growing district, “Big Island” of Hawaii;Medium Light;$74.95/8 ounces;56;78;33.05;74.95;Hawaii;Holualoa, Hawaii;USA;United States
Kenya Kirinyaga Mukangu AB;95;Chia-Yi, Taiwan;Kirinyaga District, south-central Kenya;Medium Light;NT $650/16 ounces;54;76;143.3;650;Kenya;Chia-Yi, Taiwan;Taiwan;Kenya
Ethiopia Washed Yirgacheffe Adado;95;Chia-Yi, Taiwan;Yirgacheffe growing region, southern Ethiopia;Medium Light;NT $550/16 ounces;56;78;121.25;550;Ethiopia;Chia-Yi, Taiwan;Taiwan;Ethiopia
Ace Espresso;94;Toronto, Ontario, Canada;Mexico, Ethiopia;Medium Light;CAD $18.00/12 ounces;52;74;5.29;;Ethiopia;Toronto, Canada;Canada;Ethiopia
Kenya Mutungati;94;Toronto, Ontario, Canada;Nakuru Province, south-central Kenya;Medium Light;CAD $21.00/12 ounces;54;80;6.17;;Kenya;Toronto, Canada;Canada;Kenya
Ethiopia Gedeb Halo Beriti;94;Hamilton, Montana;Gedeb District, Gedeo Zone, southern Ethiopia;Medium;$16.50/12 ounces;48;70;4.85;45793;Ethiopia;Hamilton, Montana;USA;Ethiopia
Ethiopia Sidama;94;Oakville, Ontario, Canada;Sidama (also Sidamo) growing region, southern Ethiopia;Medium;CAD $17.00/12 ounces;47;72;5;;Ethiopia;Oakville, Canada;Canada;Ethiopia
Thiriku AA Kenya;95;Topeka, Kansas;Central Kenya;Medium;$24.50/12 ounces;47;65;7.2;45801;Kenya;Topeka, Kansas;USA;Kenya
Flora Blend Espresso;94;Hong Kong, China;Africa, Asia Pacific;Medium Light;HKD $158/227 grams;54;77;69.6;;Pacific;Hong Kong, China;China;
“Sweety” Espresso Blend;95;Hong Kong, China;Panama, Ethiopia;Medium Light;HKD $250/227 grams;50;73;110.13;;Ethiopia;Hong Kong, China;China;Ethiopia
“Fruity” Espresso Blend;95;Hong Kong, China;Ethiopia, Kenya, China;Medium Light;HKD $200/227 grams;54;78;88.11;;China;Hong Kong, China;China;China
El Aquila Pacamara Espresso;94;Madison, Wisconsin;Santa Ana region, El Salvador;Medium Light;$17.90/12 ounces;54;75;5.26;45917;Salvador;Madison, Wisconsin;USA;El Salvador
Guatemala Finca El Injerto Gesha;94;San Diego, California;Huehuetenango Department, Guatemala;Medium Light;$51.00/8 ounces;56;82;22.49;51;Guatemala;San Diego, California;USA;Guatemala
Kenya Gatomboya AA;94;Boulder, Colorado;Nyeri growing region, south-central Kenya;Medium Light;$18.00/12 ounces;56;76;5.29;18;Kenya;Boulder, Colorado;USA;Kenya
Flight Seasonal Espresso;95;Floyd, Virginia;Colombia, Ethiopia, Kenya;Medium Light;$16.49/12 ounces;56;80;4.85;16.49;Kenya;Floyd, Virginia;USA;Kenya
A.G.E. Duetto Espresso;95;Kaohsiung City, Taiwan;Panama, Ethiopia;Medium Light;$26.00/8 ounces;56;76;11.46;26;Ethiopia;Kaohsiung, Taiwan;Taiwan;Ethiopia
Kenya Nyeri Hill Farm;94;Austin, Texas;Nyeri growing region, south-central Kenya;Medium Light;$18.00/12 ounces;55;79;5.29;18;Kenya;Austin, Texas;USA;Kenya
Jinotega Geisha;94;Ramsey, Minnesota;Jinotega growing region, Nicaragua;Medium Light;$18.95/12 ounces;53;78;5.57;18.95;Nicaragua;Ramsey, Minnesota;USA;Nicaragua
Nicaragua Un Regalo de Dios Bourbon;94;Torrington, Connecticut;Nueva Segovia growing region, Nicaragua;Medium Light;$16.99/12 ounces;56;81;4.99;16.99;Nicaragua;Torrington, Connecticut;USA;Nicaragua
Gedeb Lot 83 Ethiopia Natural;95;Madison, Wisconsin;Gedeb District, Gedeo Zone, southern Ethiopia;Medium Light;$18.95/12 ounces;58;82;5.57;18.95;Ethiopia;Madison, Wisconsin;USA;Ethiopia
Halo Beriti Ethiopia;94;Madison, Wisconsin;Gedeb District, Gedeo Zone, southern Ethiopia;Medium Light;$17.90/12 ounces;53;77;5.26;45917;Ethiopia;Madison, Wisconsin;USA;Ethiopia
Ethiopia Konga Sede;94;Floyd, Virginia;Yirgacheffe growing region, southern Ethiopia;Medium Light;$16.49/12 ounces;60;78;4.85;16.49;Ethiopia;Floyd, Virginia;USA;Ethiopia
Static Amaro Gayo Natural Ethiopia;95;Chino, California;Yirgacheffe growing region, southern Ethiopia;Medium;$17.00/12 ounces;45;61;5;17;Ethiopia;Chino, California;USA;Ethiopia
Static Cali Classic Espresso;94;Chino, California;Ethiopia, Colombia;Medium Light;$14.95/12 ounces;54;68;4.39;14.95;Colombia;Chino, California;USA;Colombia
Shine Day El Salvador;94;Taipei, Taiwan;El Salvador;Light;NT $490/225 grams;61;84;217.78;17.28395062;Salvador;Taipei, Taiwan;Taiwan;El Salvador
Kenya Kirinyaga Baragwi Guama AB;95;Chia-Yi, Taiwan;Kirinyaga District, south-central Kenya;Medium Light;NT $600/16 ounces;59;77;132.28;600;Kenya;Chia-Yi, Taiwan;Taiwan;Kenya
Guatemala Finca El General Espresso;94;Chia-Yi, Taiwan;Acatenango growing region, central Guatemala;Medium Light;NT $550/16 ounces;56;76;121.25;550;Guatemala;Chia-Yi, Taiwan;Taiwan;Guatemala
Ethiopia Guji Zone Natural;94;Daejeon, South Korea;Guji Zone, southern Ethiopia;Light;KRW $13,000/200 grams;60;82;6.5;;Ethiopia;Daejeon, South Korea;South Korea;Ethiopia
Kenya Boma AA;94;Tulsa, Oklahoma;Baringo and Nakura Counties, central Kenya;Medium Light;$15.99/12 ounces;53;76;4.7;15.99;Kenya;Tulsa, Oklahoma;USA;Kenya
Colombia Finca Campoalegre;94;Durango, Colorado;Pitalito, Huila Department, southern Colombia;Medium Light;$12.95/12 ounces;55;77;3.81;35034;Colombia;Durango, Colorado;USA;Colombia
Kenya Boma Peaberry;94;Tulsa, Oklahoma;Baringo and Nakura Counties, central Kenya;Medium Light;$16.99/12 ounces;54;76;4.99;16.99;Kenya;Tulsa, Oklahoma;USA;Kenya
Panama Geisha;94;Lincoln, California;Boquete growing region, western Panama;Medium Dark;$29.99/12 ounces;34;52;8.82;29.99;Panama;Lincoln, California;USA;Panama
Esmeralda Special Auction Washed Geisha;94;Boulder, Colorado;Boquete growing region, western Panama;Medium Light;$50.00/8 ounces;54;78;22.05;50;Panama;Boulder, Colorado;USA;Panama
Gesha Village 1931, Lot 86;95;Charlottesville, Virginia;Bench-Maji Zone, Southern Ethiopia;Medium Light;$75.00/8 ounces;54;78;33.07;75;Ethiopia;Charlottesville, Virginia;USA;Ethiopia
Gesha Village Natural Oma Block Lot 72;95;Chia-Yi, Taiwan;Bench-Maji Zone, Southern Ethiopia;Medium Light;NT $3200/16 ounces;56;77;705.48;3200;Ethiopia;Chia-Yi, Taiwan;Taiwan;Ethiopia
Gesha Village Lot 76 Nasha Block;95;Kaohslung City, Taiwan;Bench-Maji Zone, Southern Ethiopia;Light;$37.00/4 ounces;64;86;32.63;37;Ethiopia;Kaohslung, Taiwan;Taiwan;Ethiopia
Gesha Village Auction Lot 26 Gori Gesha Natural;95;Markham, Ontario, Canada;Bench-Maji Zone, Southern Ethiopia;Medium Light;CAD $30.00/100 grams;54;74;30;;Ethiopia;Markham, Canada;Canada;Ethiopia
Carmen Geisha El Palomar Best of Panama #4 Carlos Aguilera;96;Boulder, Colorado;Boquete growing region, western Panama;Medium Light;$50.00/8 ounces;54;78;22.05;50;Panama;Boulder, Colorado;USA;Panama
Karuthi Espresso;95;Madison, Wisconsin;Nyeri growing region, south-central Kenya;Medium Light;$18.95/12 ounces;53;77;5.57;18.95;Kenya;Madison, Wisconsin;USA;Kenya
Chelelektu Espresso;94;Madison, Wisconsin;Yirgacheffe growing region, southern Ethiopia;Medium Light;$17.25/12 ounces;51;73;5.07;17.25;Ethiopia;Madison, Wisconsin;USA;Ethiopia
Karuthi Kenya;95;Madison, Wisconsin;Nyeri growing region, south-central Kenya;Medium Light;$18.95/12 ounces;53;76;5.57;18.95;Kenya;Madison, Wisconsin;USA;Kenya
Finca El Obraje Colombia Gesha;95;Santa Rosa Beach, Florida;Narino Department, southern Colombia;Medium;$29.95/6 ounces;46;64;17.61;29.95;Colombia;Santa Rosa Beach, Florida;USA;Colombia
Kenya AA Top Nyeri Tekangu Tegu Microlot;94;Seoul, South Korea;Nyeri growing region, south-central Kenya;Medium Dark;KRW 19,000/200 grams;41;49;9.5;;Kenya;Seoul, South Korea;South Korea;Kenya
Washed Ethiopia Yirgacheffe Banko Gotiti;95;Taipei, Taiwan;Kochere, Yirgacheffe growing region, south-central Ethiopia;Medium Light;NT $550/8 ounces;58;82;242.5;550;Ethiopia;Taipei, Taiwan;Taiwan;Ethiopia
Sumatra Danau Toba;94;Ramsey, Minnesota;Lintong growing region, North Sumatra Province, Sumatra, Indonesia;Medium Light;$16.95/12 ounces;55;77;4.98;16.95;Indonesia;Ramsey, Minnesota;USA;Indonesia
Kapsakiso Kenya;94;Lexington, Virginia;Bungoma region, western Kenya;Light;$18.95/12 ounces;60;84;5.57;18.95;Kenya;Lexington, Virginia;USA;Kenya
Ethiopia Washed Kayon Mountain;95;Chia-Yi, Taiwan;Odo Shakiso District, Guji Zone, southern Ethiopia;Medium Light;NT $550/16 ounces;58;80;121.25;550;Ethiopia;Chia-Yi, Taiwan;Taiwan;Ethiopia
Ninety Plus Gesha Estates Limited Batch #227;97;Madison, Wisconsin;Chiriqui Province, far western Panama;Light;$68.50/4 ounces;67;97;60.41;68.5;Panama;Madison, Wisconsin;USA;Panama
Tano Batak Sumatra;95;Madison, Wisconsin;Lintong growing region, North Sumatra Province, Sumatra, Indonesia;Medium Light;$16.50/12 ounces;54;80;4.85;45793;Indonesia;Madison, Wisconsin;USA;Indonesia
Makwa Kenya AB;94;Chicago, Illinois;Nyeri growing region, south-central Kenya;Light;$14.00/12 ounces;62;84;4.12;14;Kenya;Chicago, Illinois;USA;Kenya
Finca El Guamo Colombia;94;Tulsa, Oklahoma;Gaitania, Tolima Department, central Colombia;Medium Light;$15.99/12 ounces;54;75;4.7;15.99;Colombia;Tulsa, Oklahoma;USA;Colombia
Kenya Ndaroini AA;94;Boulder, Colorado;Nyeri growing region, south-central Kenya;Medium Light;$20.00/12 ounces;54;76;5.88;20;Kenya;Boulder, Colorado;USA;Kenya
El Salvador Finca Kilimanjaro Natural;94;San Diego, California;Santa Ana Department, El Salvador;Medium Light;$35.00/12 ounces;54;78;10.29;35;Salvador;San Diego, California;USA;El Salvador
Kamagogo Kenya;96;Madison, Wisconsin;Murang’a Foothills, Aberdare Ridge, Central Province, Kenya;Medium Light;$20.90/12 ounces;53;76;6.14;45920;Kenya;Madison, Wisconsin;USA;Kenya
Twisted 4.0 Espresso;94;Madison, Wisconsin;Not disclosed;Medium Light;$15.75/12 ounces;53;75;4.63;15.75;;Madison, Wisconsin;USA;
El Salvador Finca Kilimanjaro Cascara Fermentation Aida Batlle;95;Topeka, Kansas;Santa Ana Department, El Salvador;Medium;$35.00/12 ounces;50;71;10.29;35;Salvador;Topeka, Kansas;USA;El Salvador
Puna Natural;94;Mountain View, Hawaii;Puna District, Big Island of Hawaii;Medium Light;$29.00/10 ounces;54;74;10.23;29;Hawaii;Mountain View, Hawaii;USA;United States
Colombia La Palma Y El Tucan Gesha;94;San Diego, California;Cundinamarca Department, central Colombia;Light;;62;84;;;Colombia;San Diego, California;USA;Colombia
Bourbon Peaberry;94;Holulaloa, Hawaii;Holualoa, North Kona growing district, “Big Island” of Hawaii;Medium Light;$49.95/8 ounces;54;80;22.02;49.95;Hawaii;Holualoa, Hawaii;USA;United States
Sumatra Boru Batak;94;Vancouver, British Columbia, Canada;Lintong growing region, North Sumatra Province, Sumatra, Indonesia;Medium Light;$14.99/12 ounces;54;80;4.41;14.99;Indonesia;Vancouver, Canada;Canada;Indonesia
Gesha Village Estate Bench Maji Gesha G1;95;Boulder, Colorado;Bench-Maji Zone, Southern Ethiopia;Medium Light;$35.00/8 ounces;55;78;15.43;35;Ethiopia;Boulder, Colorado;USA;Ethiopia
Bourbon-Barrel-Aged Kenya Baragu;94;San Diego, California;Central Kenya;Medium Light;$20.00/8 ounces;55;76;8.82;20;Kenya;San Diego, California;USA;Kenya
Aged Sumatra Ulos Batak Peaberry;94;San Rafael, California;Dolok Sanggul, Lintong growing region, North Sumatra, Indonesia;Medium Light;$18.00/12 ounces;53;73;5.29;18;Indonesia;San Rafael, California;USA;Indonesia
Colombia La Palma and El Tucan Espresso;94;Chia-Yi, Taiwan;Cundinamarca Department, central Colombia;Medium Light;NT $500/16 ounces;51;72;110.23;500;Colombia;Chia-Yi, Taiwan;Taiwan;Colombia
Flight Seasonal Espresso;94;Floyd, Virginia;Ethiopia;Medium Light;$14.49/12 ounces;56;80;4.26;14.49;Ethiopia;Floyd, Virginia;USA;Ethiopia
Kenya Kabare AA;96;Billings, Montana;South-central Kenya;Medium Light;$14.50/12 ounces;56;77;4.26;45791;Kenya;Billings, Montana;USA;Kenya
Gesha, Gesha Village 1931;94;Charlottesville, Virginia;Bench-Maji Zone, Southern Ethiopia;Medium Light;$88.00/8 ounces;56;77;38.8;88;Ethiopia;Charlottesville, Virginia;USA;Ethiopia
Aricha Yirgacheffe Ethiopia;94;Lee, Massachusetts;Yirgacheffe growing region, southern Ethiopia;Medium Light;$19.95/12 ounces;58;82;5.86;19.95;Ethiopia;Lee, Massachusetts;USA;Ethiopia
Guatemala Finca Cappuccino “Echo-Lot” Espresso;95;Chia-Yi, Taiwan;Cobán region, Alta Verapaz Department, Guatemala;Medium Light;NT $450/16 ounces;50;74;99.21;450;Guatemala;Chia-Yi, Taiwan;Taiwan;Guatemala
Ethiopia Guji Shakiso Danbi Uddo;94;Phoenix, Arizona;Guji Zone, southern Ethiopia;Medium Light;$18.00/12 ounces;56;76;5.29;18;Ethiopia;Phoenix, Arizona;USA;Ethiopia
Kenya AA Gura Auction Lot;94;Youngstown, Ohio;Central Kenya;Medium Light;$12.75/10 ounces;56;76;4.5;27729;Kenya;Youngstown, Ohio;USA;Kenya
100% Kona Bourbon Pointu Laurina;96;Holulaloa, Hawaii;Holualoa, North Kona growing district, “Big Island” of Hawaii;Medium Light;$49.95/8 ounces;56;76;22.02;49.95;Hawaii;Holualoa, Hawaii;USA;United States
Yirgacheffe G1 Idido;95;Taichung, Taiwan;Yirgacheffe growing region, southern Ethiopia;Medium Light;NT $760/8 ounces;56;76;335.1;760;Ethiopia;Taichung, Taiwan;Taiwan;Ethiopia
Yemen Port of Mokha Hayma Microlot;97;Boulder, Colorado;Hayma, north-central Yemen;Medium;$85.00/8 ounces;47;68;37.48;85;Yemen;Boulder, Colorado;USA;Yemen
Edgar Motta Colombia Pink Bourbon;94;Denver, Colorado;San Adolfo, Acevedo, Huila Department, Colombia;Medium Light;$19.00/12 ounces;59;78;5.59;19;Colombia;Denver, Colorado;USA;Colombia
Papua New Guinea PB Kimel Estate;94;St. Louis, MIssouri;Waghi Valley, Western Highlands Province, Papua New Guinea;Medium Light;$17.49/16 ounces;56;70;3.86;17.49;Guinea;St. Louis, Missouri;USA;
Panama La Esmeralda Noria Enero Geisha;95;Sacramento, California;Boquete growing region, western Panama;Medium Light;$76.00/8 ounces;57;83;33.51;76;Panama;Sacramento, California;USA;Panama
Rwanda Bufcafe;95;Madison, Wisconsin;Nyamagabe district, Southern Province,Rwanda;Medium Light;$17.25/12 ounces;54;78;5.07;17.25;Rwanda;Madison, Wisconsin;USA;Rwanda
Ethiopia Queen Sheba Natural Yirgacheffe Phoenix Special;94;Taoyuan City, Taiwan;Yirgacheffe growing region, southern Ethiopia;Medium Light;NT $1500/16 ounces;54;76;330.7;1500;Ethiopia;Taoyuan, Taiwan;Taiwan;Ethiopia
Ulos Batak Sumatra Peaberry;97;Madison, Wisconsin;Northern Sumatra, Indonesia;Medium Light;$18.60/12 ounces;57;76;5.47;45826;Indonesia;Madison, Wisconsin;USA;Indonesia
Bernachon High-Level Espresso;94;New Taipei City, Taiwan;Brazil, Mandheling, Sumatra, Guatemala, Ethiopia;Medium;RMB $100.00/454 grams;50;64;22.03;;Ethiopia;New Taipei, Taiwan;Taiwan;Ethiopia
Mora Negra Geisha Hartmann Farm;95;Charlottesville, Virginia;Chiriqui Province, far western Panama;Medium Light;$29.00/8 ounces;56;78;12.79;29;Panama;Charlottesville, Virginia;USA;Panama
Gori Gesha Forest;95;Charlottesville, Virginia;Bench-Maji Zone, western Ethiopia;Medium Light;$35.00/8 ounces;54;74;15.43;35;Ethiopia;Charlottesville, Virginia;USA;Ethiopia
Ethiopia Natural Hambela Buku;94;Chia-Yi, Taiwan;Hambela Wamena District, Guji Zone, Oromia Region, southern Ethiopia;Medium Light;$19.00/16 ounces;58;78;4.19;19;Ethiopia;Chia-Yi, Taiwan;Taiwan;Ethiopia
Panama Camilina Natural Geisha;94;Los Angeles, California;Piedra Candela, Chiriqui Province, far western Panama;Medium Light;$49.95/8 ounces;58;78;22.02;49.95;Panama;Los Angeles, California;USA;Panama
Kenya Nyeri Thageini Peaberry;94;Seattle, Washington;Nyeri growing region, south-central Kenya;Medium Light;$19.50/12 ounces;52;71;5.73;45796;Kenya;Seattle, Washington;USA;Kenya
Single-Origin Nitro;95;Madison, Wisconsin;Ethiopia;Light;$3.49/12 ounces;;;1.03;17958;Ethiopia;Madison, Wisconsin;USA;Ethiopia
Hawaii Kilauea Volcano Nano-Lot;96;Ramsey, Minnesota;Puna District, “Big Island” of Hawaii;Medium Light;$24.00/4 ounces;59;82;21.16;24;Hawaii;Ramsey, Minnesota;USA;United States
Ethiopia Charbanta Natural;95;Driftless, Wisconsin;Yirgacheffe growing region, southern Ethiopia;Medium Light;$18.00/12 ounces;60;80;5.29;18;Ethiopia;Driftless, Wisconsin;USA;Ethiopia
Panama Don Julian Pacamara;95;Branford, Connecticut;Boquete growing region, western Panama;Light;$49.99/16 ounces;65;82;11.02;49.99;Panama;Branford, Connecticut;USA;Panama
Esmeralda Noria Natural;95;Topeka, Kansas;Boquete growing region, western Panama;Medium Light;$47.50/8 ounces;58;78;20.94;47.5;Panama;Topeka, Kansas;USA;Panama
Miami Winter Holiday Blend;94;Miami, Florida;Ethiopia, Kenya;Light;$20.00/8 ounces;62;84;8.82;20;Kenya;Miami, Florida;USA;Kenya
Duncan Estate Panamanian Gesha;94;Ashland, Oregon;Boquete growing region, western Panama;Light;$32.00/8 ounces;66;82;14.11;32;Panama;Ashland, Oregon;USA;Panama
