Ethiopia Yirgacheffe Israel Degfa Natural Gr.1;94;Kaohsiung City, Taiwan;Yirgachefffe growing region, southern Ethiopia;Medium Light;NT $450/227 grams;56;76;198.24;15.87301587;Ethiopia;Kaohsiung, Taiwan;Taiwan;Ethiopia
Panama Elida Estate Washed;96;Jersey City, New Jersey;Boquete growing region, western Panama;Medium Light;$60.00/150 grams;59;77;40;2.116402116;Panama;Jersey, New Jersey;USA;Panama
Bourbon Barrel Aged Ethiopia Cold Brew;94;Glendale, California;Yirgacheffe growing region, southern Ethiopia;;$11.00/375 ml. flask;0;0;;;Ethiopia;Glendale, California;USA;Ethiopia
Kona Maragogype Natural;94;Minneapolis, Minnesota;Kainaliu, Kona, Big Island of Hawai’i;Medium Light;$29.95/4 ounces;58;82;26.41;29.95;;Minneapolis, Minnesota;USA;
Kenya Washed Nakuru Gachombe Factory AB;95;Chia-Yi, Taiwan;Nakuru County, Kenya;Medium Light;NT $210/8 ounces;56;78;92.59;210;Kenya;Chia-Yi, Taiwan;Taiwan;Kenya
Ethiopia Natural Guji Hambella Wate Peaberry;95;Chia-Yi, Taiwan;Guji Zone, Oromia Region, Ethiopia;Light;NT $375/8 ounces;62;84;165.34;375;Ethiopia;Chia-Yi, Taiwan;Taiwan;Ethiopia
Ethiopia Guji Shakiso Dambi Udo Natural Anaerobic;94;Taipei, Taiwan;Guji Zone, southern Ethiopia;Medium Light;NT $360/225 grams;59;77;160;12.6984127;Ethiopia;Taipei, Taiwan;Taiwan;Ethiopia
Ethiopia Natural Guji;94;Chia-Yi, Taiwan;Guji Zone, Oromia region, southern Ethiopia;Medium Light;NT $210/8 ounces;56;76;92.59;210;Ethiopia;Chia-Yi, Taiwan;Taiwan;Ethiopia
Costa Rica Yellow Honey Kinka Bear Lot 20-02;94;Chia-Yi, Taiwan;Costa Rica;Medium Light;NT $250/8 ounces;52;70;110.23;250;Rica;Chia-Yi, Taiwan;Taiwan;Costa Rica
Ethiopia Guji Shakiso Dambi Udo Honey;94;Taipei, Taiwan;Guji Zone, southern Ethiopia;Light;NT $350/225 grams;62;80;155.56;12.34567901;Ethiopia;Taipei, Taiwan;Taiwan;Ethiopia
Kenya Washed Nyeri Gichathaini Factory AB;94;Chia-Yi, Taiwan;yeri growing region, south-central Kenya;Medium Light;NT $390/8 ounces;60;78;171.96;390;Kenya;Chia-Yi, Taiwan;Taiwan;Kenya
Colombia Pink Bourbon Honey;95;San Diego, California;Huila Department, Colombia;Medium Light;$29.00/12 ounces;60;80;8.52;29;Colombia;San Diego, California;USA;Colombia
Karatina Kenya;95;Madison, Wisconsin;Nyeri growing region, south-central Kenya;Medium Light;$22.00/12 ounces;60;78;6.47;22;Kenya;Madison, Wisconsin;USA;Kenya
Cerro Azul Geisha;95;Madison, Wisconsin;Trujillo, Valle del Cauca Department, Colombia;Light;$28.00/8 ounces;62;80;12.35;28;Colombia;Madison, Wisconsin;USA;Colombia
Kona SL34 Sweet Spot;94;Holualoa, Hawaii;Kona growing region, Big Island of Hawai’i;Medium Light;$49.95/7 ounces;58;80;25.17;49.95;;Holualoa, Hawaii;USA;
Haraaz Red;95;Madison, Wisconsin;Haraaz growing region, Yemen;Medium Light;$17.50/8 ounces;58;82;7.72;45794;Yemen;Madison, Wisconsin;USA;Yemen
Kona Mocca®;96;Holualoa, Hawai’i;Holualoa, North Kona growing district, “Big Island” of Hawai’i;Medium Light;$87.50/8 ounces;56;74;38.58;87.5;;Holualoa, Hawaii;USA;
Panama Elida Green-Tip Geisha La Torre ASD;95;Branford, Connecticut;Boquete growing region, western Panama;Light;$120.00/16 ounces;62;84;26.46;120;Panama;Branford, Connecticut;USA;Panama
Kona Peaberry;94;Mountain View, Hawai’i;Kona growing region, Big Island of Hawai’i;Medium Light;$35.00/10 ounces;56;76;12.35;35;;Mountain View, Hawaii;USA;
Panama Finca Los Lajones Natural;94;San Diego, California;Boquete growing region, Panama;Light;$29.00/12 ounces;60;82;8.52;29;Panama;San Diego, California;USA;Panama
SL28;94;Captain Cook, Hawai’i;North Kona growing district, “Big Island” of Hawai’i;Medium Light;$33.00/8 ounces;56;76;14.55;33;;Captain Cook, Hawaii;USA;
Bourbon Pointu Natural;94;Holualoa, Hawai’i;Kona growing region, Big Island of Hawai’i;Medium Light;$50.00/7 ounces;58;76;25.2;50;;Holualoa, Hawaii;USA;
Ethiopia Guji Hambela Buku Abel Slow Dry Natural 2400m;94;Douliou City, Taiwan;Guji Zone, Oromia Region, Southern Ethiopia;Light;NT $400/220 grams;64;82;181.82;14.10934744;Ethiopia;Douliou, Taiwan;Taiwan;Ethiopia
Yemen Al Mashtal Al Burhani;94;Minneapolis, Minnesota;Haraaz growing region, Yemen;Medium Light;$24.95/4 ounces;58;78;22;24.95;Yemen;Minneapolis, Minnesota;USA;Yemen
Flight Seasonal Espresso;95;Floyd, Virginia;Ethiopia, Dominican Republic;Medium Light;$18.99/12 ounces;58;74;5.58;18.99;Republic;Floyd, Virginia;USA;
Panama Boquete Flor De Mariposa Geisha Espresso;96;Chia-Yi, Taiwan;Boquete growing region, western Panama;Medium Light;NT $500/8 ounces;54;76;220.46;500;Panama;Chia-Yi, Taiwan;Taiwan;Panama
Guji Ethiopia Washed;94;Johns Creek, Georgia;Guji Zone, Oromia Region, southern Ethiopia;Light;$17.99/12 ounces;62;84;5.29;17.99;Ethiopia;Johns Creek, Georgia;USA;Ethiopia
Colombia Monteblanco Geisha;94;Harrisonburg, Virginia;Huila Department, Colombia;Light;$9.99/4 ounces;64;82;8.81;36404;Colombia;Harrisonburg, Virginia;USA;Colombia
Ethiopia Gedeo Kochere Reko Natural;94;Chia-Yi, Taiwan;Yirgacheffe growing region, southern Ethiopia;Light;$16.00/230 grams;64;84;6.96;0.564373898;Ethiopia;Chia-Yi, Taiwan;Taiwan;Ethiopia
Costa Rica Aris Red Honey Lot 2002 Espresso;94;Chia-Yi, Taiwan;Central Valley, Costa Rica;Medium Light;NT $270/8 ounces;52;70;119.05;270;Rica;Chia-Yi, Taiwan;Taiwan;Costa Rica
Twisted V.6 Espresso;94;Madison, Wisconsin;South America, Central America, Africa;Medium Light;$15.75/12 ounces;54;74;4.63;15.75;Africa;Madison, Wisconsin;USA;
Aged Sumatra Ulos Batak 2015;94;Minneapolis, Minnesota;Lintong growing region, Sumatra, Indonesia;Medium;$18.95/12 ounces;45;63;5.57;18.95;Indonesia;Minneapolis, Minnesota;USA;Indonesia
Kona Uluwehi SL34;94;Minneapolis, Minnesota;Holualoa, Kona, Big Island of Hawai’i;Medium Light;$29.95/4 ounces;60;80;26.41;29.95;;Minneapolis, Minnesota;USA;
Colombia Pink Bourbon Finca El Chaparote;94;Minneapolis, Minnesota;Huila Department, Colombia;Light;$14.95/6 ounces;64;82;8.79;14.95;Colombia;Minneapolis, Minnesota;USA;Colombia
Ethiopia Neja Fadil;94;San Diego, California;Guji Zone, Oromia Region, southern Ethiopia;Medium Light;$20.00/12 ounces;58;78;5.88;20;Ethiopia;San Diego, California;USA;Ethiopia
Peru Buena Vista Valerio Almanza Ccahua;94;Manlius, New York;Cusco, Peru;Medium Light;$27.00/8 ounces;60;78;11.9;27;Peru;Manlius, New York;USA;Peru
Panama Finca Santa Teresa Lot 9;94;Reno, Nevada;Volcan growing region, western Panama;Medium Light;$20.00/12 ounces;60;78;5.88;20;Panama;Reno, Nevada;USA;Panama
Guatemala Cobán Chicoj Cooperative Red Honey Fair Trade;94;Yilan, Taiwan;Cobán growing region, central Guatemala;Medium Light;NT $320/200 grams;58;78;160;11.28747795;Guatemala;Yilan, Taiwan;Taiwan;Guatemala
Ethiopia Halo Hartume Daniel Mijane;94;Reno, Nevada;Yirgacheffe growing region, southern Ethiopia;Medium Light;$19.00/12 ounces;58;78;5.59;19;Ethiopia;Reno, Nevada;USA;Ethiopia
Colombia Cauca El Paraiso;96;Osaka, Japan;Cauca, Colombia;Light;¥ 1,580/100 grams;85;105;1;;Colombia;Osaka, Japan;Japan;Colombia
Taiwan Songyue Geisha;94;Osaka, Japan;Yunlin, Taiwan;Light;¥ 2,640/50 grams;79;92;4;;Taiwan;Osaka, Japan;Japan;Taiwan
Kenya Nyeri;94;Taipei, Taiwan;Nyeri growing region, south-central Kenya;Medium Light;NT $650/225 grams;60;78;288.89;22.92768959;Kenya;Taipei, Taiwan;Taiwan;Kenya
Kenya Kirinyaga Baragwi Karumandi AA;94;Durango, Colorado;South-central Kenya;Medium Light;$16.95/12 ounces;54;74;4.98;16.95;Kenya;Durango, Colorado;USA;Kenya
Harimau Tiger Sumatra;94;Madison, Wisconsin;Aceh Province, Sumatra, Indonesia;Medium Light;$17.00/12 ounces;54;74;5;17;Indonesia;Madison, Wisconsin;USA;Indonesia
Ethiopia Sidamo Washed;95;Taipei, Taiwan;Sidama (also Sidamo) growing region, southern Ethiopia;Medium Light;NT $372/227 grams;58;78;163.88;13.12169312;Ethiopia;Taipei, Taiwan;Taiwan;Ethiopia
Ethiopia Guji Uraga Washed;95;Taipei, Taiwan;Guji Zone, southern Ethiopia;Medium Light;NT $252/227 grams;60;78;111.01;8.888888889;Ethiopia;Taipei, Taiwan;Taiwan;Ethiopia
Indonesia Golden Sumatra TP Espresso;96;Yilan, Taiwan;Aceh Province, Sumatra, Indonesia;Medium;NT $450/200 grams;44;62;225;15.87301587;Indonesia;Yilan, Taiwan;Taiwan;Indonesia
Kenya Gachatha;95;Sacramento, California;South-central Kenya;Medium Light;$22.50/12 ounces;54;72;6.61;45799;Kenya;Sacramento, California;USA;Kenya
Ethiopia Suke Quto Single-Origin Espresso;94;Sacramento, California;Guji Zone, Oromia Region, south-central Ethiopia;Medium Light;$19.00/12 ounces;52;72;5.59;19;Ethiopia;Sacramento, California;USA;Ethiopia
Ethiopia Gera Limu;94;Sacramento, California;Oromia growing region, southern Ethiopia;Medium Light;$19.00/12 ounces;58;80;5.59;19;Ethiopia;Sacramento, California;USA;Ethiopia
Panama Pacamara Natural;94;Lloydminster, Saskatchewan, Canada;Volcan growing region, western Panama;Medium Light;CAD $50/200 grams;52;70;25;;Panama;Lloydminster, Canada;Canada;Panama
Ka’u Pink Honey;94;Minneapolis, Minnesota;Ka'u District, Big Island of Hawai’i;Light;$24.95/4 ounces;64;84;22;24.95;;Minneapolis, Minnesota;USA;
Kona Maragogype Pink Honey;94;Minneapolis, Minnesota;Kainaliu, Kona District, Big Island of Hawai’i;Light;$29.95/4 ounces;64;86;26.41;29.95;;Minneapolis, Minnesota;USA;
RD1 Espresso Blend;95;Hsinchu, Taiwan;Guatemala, Ethiopia, Brazil, Indonesia;Medium Light;NT $300/8 ounces;54;72;132.28;300;Indonesia;Hsinchu, Taiwan;Taiwan;Indonesia
Bull Espresso Blend;95;New Taipei City, Taiwan;Guatemala, Brazil, Kenya;Medium Light;NT $450/454 grams;56;76;99.12;15.87301587;Kenya;New Taipei, Taiwan;Taiwan;Kenya
Ethiopia Yirgacheffe Gotiti Natural;95;Hsinchu, Taiwan;Yirgacheffe growing region, southern Ethiopia;Medium Light;NT $380/8 ounces;58;80;167.55;380;Ethiopia;Hsinchu, Taiwan;Taiwan;Ethiopia
Ethiopia Demeka Becha;95;Floyd, Virginia;Sidama growing region, southern Ethiopia;Light;$21.99/12 ounces;64;82;6.46;21.99;Ethiopia;Floyd, Virginia;USA;Ethiopia
Trust the Process — Full Natural;96;Floyd, Virginia;Los Naranjos, La Argentina, Huila Department, Colombia;Light;$18.99/8 ounces;64;84;8.37;18.99;Colombia;Floyd, Virginia;USA;Colombia
Colombia Finca El Caucho Pink Bourbon;95;Minneapolis, Minnesota;Huila, Colombia;Light;$16.95/6 ounces;62;80;9.96;16.95;Colombia;Minneapolis, Minnesota;USA;Colombia
Colombia Antioquia Natural Carbonic Maceration Caturra;95;Chia-Yi, Taiwan;Antioquia Department, Colombia;Medium Light;NT $310/8 ounces;60;80;136.68;310;Colombia;Chia-Yi, Taiwan;Taiwan;Colombia
Colombia La Gallera Estate;94;Chia-Yi, Taiwan;Tolima Department, Colombia;Light;NT $620/8 ounces;64;84;273.37;620;Colombia;Chia-Yi, Taiwan;Taiwan;Colombia
Colombia Diofanor Ruiz;94;Hong Kong, China;Quindío Department, Colombia;Medium Light;$25.00/6 ounces;58;76;14.7;25;Colombia;Hong Kong, China;China;Colombia
Colombia Java El Edén Limited Edition;94;Columbus, Ohio;Tolima, Colombia;Medium Light;$30.00/12 ounces;58;80;8.82;30;Colombia;Columbus, Ohio;USA;Colombia
Finca La Maria Geisha Natural;94;Taipei City, Taiwan;Cundinamarca, Colombia;Light;NT $1300/4 ounces;62;80;1146.38;1300;Colombia;Taipei, Taiwan;Taiwan;Colombia
Angamaza;94;Madison, Wisconsin;Conganama, Loja Province, Ecuador;Medium Light;$20.00/12 ounces;60;78;5.88;20;Ecuador;Madison, Wisconsin;USA;Ecuador
Ethiopia Rhapsody Espresso;95;Taipei, Taiwan;Yirgacheffe growing region, southern Ethiopia;Medium Light;NT $599/227 grams;52;70;263.88;21.1287478;Ethiopia;Taipei, Taiwan;Taiwan;Ethiopia
Kona Geisha Champagne Natural;95;Minneapolis, Minnesota;Kealakekua, Kona, Big Island of Hawaii;Light;$74.95/4 ounces;64;84;66.09;74.95;Hawaii;Minneapolis, Minnesota;USA;United States
Dafis Abafita Natural Ethiopia;95;Topeka, Kansas;Oromia Region, Jimma Zone, Ethiopia;Light;$21.50/12 ounces;64;84;6.32;45798;Ethiopia;Topeka, Kansas;USA;Ethiopia
Berg Wu Championship Sidamo Washed G1 Lot 20-02;95;Chia-Yi, Taiwan;Sidama (also Sidamo) growing region, southern Ethiopia;Light;NT $340/8 ounces;64;84;149.91;340;Ethiopia;Chia-Yi, Taiwan;Taiwan;Ethiopia
Ka’u Yellow Bourbon;94;Mountain View, Hawaii;Ka’u growing region, Big Island of Hawai'i;Medium Light;$33.00/10 ounces;60;78;11.64;33;;Mountain View, Hawaii;USA;
Ethiopia Natural Hambela Wate;95;Chia-Yi, Taiwan;Guji Zone, Oromia Region, southern Ethiopia;Medium Light;NT $310/8 ounces;58;76;136.68;310;Ethiopia;Chia-Yi, Taiwan;Taiwan;Ethiopia
Kinini Village Rwanda;94;Topeka, Kansas;Northern Province, Rulindo District, Rwanda;Medium Light;$20.00/12 ounces;58;76;5.88;20;Rwanda;Topeka, Kansas;USA;Rwanda
Ethiopia Natural Guji Uraga G1 Lot 20-05;94;Chia-Yi, Taiwan;Guji Zone, Oromia Region, southern Ethiopia;Medium Light;NT $375/8 ounces;58;78;165.34;375;Ethiopia;Chia-Yi, Taiwan;Taiwan;Ethiopia
Kenya Nyeri Muchoki Estate AA;94;Chia-Yi, Taiwan;Nyeri growing region, south-central Kenya;Light;NT $350/8 ounces;62;80;154.32;350;Kenya;Chia-Yi, Taiwan;Taiwan;Kenya
Fruity Espresso Blend;95;Hong Kong, China;Panama, Ethiopia, Kenya;Medium Light;HKD $118/200 grams;56;74;59;;Kenya;Hong Kong, China;China;Kenya
Ethiopia Yirgacheffe Cleopatra Natural;94;Taipei, Taiwan;Yirgacheffe growing region, southern Ethiopia;Medium Light;NT $600/200 grams;56;76;300;21.16402116;Ethiopia;Taipei, Taiwan;Taiwan;Ethiopia
Ethiopia Yirgacheffe Dumerso G1 Natural;94;Bozeman, Montana;Yirgacheffe growing region, southern Ethiopia;Medium Light;$18.95/12 ounces;57;73;5.57;18.95;Ethiopia;Bozeman, Montana;USA;Ethiopia
Guatemala Santa Felisa Solar Eclipse Gesha Natural;94;Taipei, Taiwan;Acatenango growing region, Guatemala;Light;NT $620/4 ounces;64;80;546.74;620;Guatemala;Taipei, Taiwan;Taiwan;Guatemala
Coral;94;Llayla District, Satipo Province, Peru;Llayla District, Satipo Province, Peru;Medium Light;$10.00/250 grams;58;78;4;0.352733686;Peru;Llayla, Peru;Peru;Peru
Ethiopia Guji Goro Muda Washed G1;95;Kaohsiung City, Taiwan;Guji Zone, southern Ethiopia;Light;NT $450/8 ounces;64;82;198.41;450;Ethiopia;Kaohsiung, Taiwan;Taiwan;Ethiopia
Ethiopian Guji Ana Sora Alcoholic Natural G1;94;Kaohsiung City, Taiwan;Guji Zone, southern Ethiopia;Medium Light;NT $300/8 ounces;60;80;132.28;300;Ethiopia;Kaohsiung, Taiwan;Taiwan;Ethiopia
Panama Hacienda La Esmeralda Gesha;96;Chicago, Illinois;Boquete growing region, western Panama;Medium Light;$56.00/8 ounces;58;78;24.69;56;Panama;Chicago, Illinois;USA;Panama
Ethiopia Cup of Excellence Guji Natural;95;Minneapolis, Minnesota;West Guji Zone, Hambela Wamena Woreda, Ethiopia;Light;$19.95/4 ounces;68;90;17.59;19.95;Ethiopia;Minneapolis, Minnesota;USA;Ethiopia
Ethiopia Sidama Telamo FTO Natural;95;Berkeley, California;Sidamo (also Sidama) growing region, south-central Ethiopia;Medium Light;$23.00/12 ounces;58;76;6.76;23;Ethiopia;Berkeley, California;USA;Ethiopia
Ethiopia Guji Laayyoo Natural;94;Minneapolis, Minnesota;Guji Zone, southern Ethiopia;Light;$24.95/12 ounces;64;82;7.33;24.95;Ethiopia;Minneapolis, Minnesota;USA;Ethiopia
Magic Cat Kenya Civet AFCA TOH NO.2 Gatuya Factory New Murarandia AA;94;Taichung City, Taiwan;Murang'a County, central Kenya;Medium Light;USD $206.00/8 ounces;56;78;90.83;;Kenya;Taichung, Taiwan;Taiwan;Kenya
Ethiopia Grade 1 Chelchele;94;San Diego, California;Yirgacheffe growing region, southern Ethiopia;Light;$22.00/12 ounces;62;80;6.47;22;Ethiopia;San Diego, California;USA;Ethiopia
Ethiopia Natural Yirgacheffe Gr.1 Cleopatra;95;Taoyuan, Taiwan;Yirgacheffe growing region, southern Ethiopia;Medium;NT $1100/8 ounces;47;73;485.01;1100;Ethiopia;Taoyuan, Taiwan;Taiwan;Ethiopia
Taiwan Alishan Zhou-Zhu-Yuan Farm Estate Reserve Washed;94;Taoyuan, Taiwan;Alishan, Taiwan;Medium;NT $1100/8 ounces;46;64;485.01;1100;Taiwan;Taoyuan, Taiwan;Taiwan;Taiwan
Ethiopia Keramo Zero Oxygen Natural;94;Redding, California;Keramo Village, Sidama Region, Ethiopia;Medium Light;$55.00/8 ounces;60;78;24.25;55;Ethiopia;Redding, California;USA;Ethiopia
Panama Elida ASD Natural;94;Jersey City, New Jersey;Boquete growing region, western Panama;Light;$60.00/150 grams;62;80;40;2.116402116;Panama;Jersey, New Jersey;USA;Panama
Peru Yanesha Geisha;94;Kaohsiung City, Taiwan;Pasco Department, Villa Rica, Peru;Medium Light;NT $1,000/8 ounces;61;79;0.44;;Peru;Kaohsiung, Taiwan;Taiwan;Peru
Ethiopia Guji Chembi;95;Keelung, Taiwan;Guji Zone, Oromia Region, southern Ethiopia;Medium Light;NT $450/227 grams;58;76;198.24;15.87301587;Ethiopia;Keelung, Taiwan;Taiwan;Ethiopia
Kenya Nyeri;94;Taipei, Taiwan;Nyeri growing region, south-central Kenya;Medium Light;NT $450/225 grams;57;77;200;15.87301587;Kenya;Taipei, Taiwan;Taiwan;Kenya
Kona Red Bourbon Anaerobic Washed Uluwehi Farm;95;Minneapolis, Minnesota;Holualoa, Kona, Big Island of Hawai’i;Medium Light;$29.95/4 ounces;58;74;26.41;29.95;;Minneapolis, Minnesota;USA;
Wush Wush;95;Floyd, Virginia;Sidama growing region, southern Ethiopia;Light;$20.99/12 ounces;60;82;6.17;20.99;Ethiopia;Floyd, Virginia;USA;Ethiopia
Honey Typica Anaerobic;95;Captain Cook, Hawai’i;North Kona growing district, “Big Island” of Hawai’i;Medium Light;$75.00/16 ounces;56;74;16.53;75;;Captain Cook, Hawaii;USA;
Geisha;94;Captain Cook, Hawaii;North Kona growing district, “Big Island” of Hawai’i;Medium Light;$33.00/8 ounces;55;71;14.55;33;;Captain Cook, Hawaii;USA;
Panama Abu Natural ASD Geisha BOP GN11;96;Chia-Yi, Taiwan;Boquete growing region, western Panama;Medium Light;NT $1200/4 ounces;58;76;1058.2;1200;Panama;Chia-Yi, Taiwan;Taiwan;Panama
Ethiopia Kochere Boji;95;Lexington, Virginia;Yirgacheffe growing region, southern Ethiopia;Medium Light;$19.95/12 ounces;60;77;5.86;19.95;Ethiopia;Lexington, Virginia;USA;Ethiopia
Panama Finca Minerva-Mirage Pacamara BOP PAC04;95;Chia-Yi, Taiwan;Boquete growing region, western Panama;Medium Light;NT $600/4 ounces;46;76;529.1;600;Panama;Chia-Yi, Taiwan;Taiwan;Panama
Tanzania Shimiligwanda;94;Lexington, Virginia;Songwe Region, southwestern Tanzania;Light;$17.95/12 ounces;62;80;5.28;17.95;Tanzania;Lexington, Virginia;USA;Tanzania
Ethiopia Natural Guji Blue-Donkey 2020;95;Chia-Yi, Taiwan;Guji Zone, Oromia Region, southern Ethiopia;Medium Light;NT $325/8 ounces;59;77;143.3;325;Ethiopia;Chia-Yi, Taiwan;Taiwan;Ethiopia
Kenya Washed Peaberry Rnyeusi;94;Chia-Yi, Taiwan;Central Province, Kenya;Medium Light;NT $325/8 ounces;52;74;143.3;325;Kenya;Chia-Yi, Taiwan;Taiwan;Kenya
Ethiopia COE 2nd place Washed Sidamo Rumudamo;94;Chia-Yi, Taiwan;Arbegona, Sidama (also Sidamo) growing region, south-central Ethiopia;Medium Light;NT $350/20 grams;60;78;1750;12.34567901;Ethiopia;Chia-Yi, Taiwan;Taiwan;Ethiopia
Ethiopia Yirgacheffe Natural Haru Suke G1;94;Chia-Yi, Taiwan;Gedeo, Yirgacheffe growing region, south-central Ethiopia;Medium Light;NT $310/8 ounces;60;80;136.68;310;Ethiopia;Chia-Yi, Taiwan;Taiwan;Ethiopia
Finca Sophia Gesha Washed;98;San Rafael, California;Nueva Suiza, Chiriquí, Panama;Medium Light;$50.00/4 ounces;58;76;44.09;50;Panama;San Rafael, California;USA;Panama
Colombia Granja La Esperanza Java Anaerobic;95;San Diego, California;Valle del Cauca growing region, Colombia;Medium Light;$85.00/6 ounces;53;73;49.97;85;Colombia;San Diego, California;USA;Colombia
Shantawene Ethiopia Daya Bensa Natural;94;San Diego, California;Sidamo (also Sidama) growing region, south-central Ethiopia;Light;$19.00/12 ounces;62;80;5.59;19;Ethiopia;San Diego, California;USA;Ethiopia
Kenya AA FAQ;94;Yilan, Taiwan;Kenya;Medium Light;NT $330/200 grams;60;77;165;11.64021164;Kenya;Yilan, Taiwan;Taiwan;Kenya
Ardent Ethiopia Natural;97;Madison, Wisconsin;Sidamo (also Sidama) growing region, south-central Ethiopia;Medium Light;$35.00/8 ounces;57;77;15.43;35;Ethiopia;Madison, Wisconsin;USA;Ethiopia
Kona Mocca®;96;Holualoa, Hawai’i;Holualoa, North Kona growing district, “Big Island” of Hawai’i;Medium Light;$74.95/8 ounces;52;70;33.05;74.95;;Holualoa, Hawaii;USA;
Holiday Coffee;94;Holualoa, Hawai’i;Holualoa, North Kona growing district, “Big Island” of Hawai’i;Medium Light;$39.95/8 ounces;54;74;17.61;39.95;;Holualoa, Hawaii;USA;
Ethiopia Dur Feres Natural;94;Floyd, Virginia;Sidamo (also Sidama) growing region, south-central Ethiopia;Medium Light;$18.99/12 ounces;60;78;5.58;18.99;Ethiopia;Floyd, Virginia;USA;Ethiopia
Kenya AA Ares Phoenix Special;96;Taoyuan, Taiwan;Nyeri growing region, south-central Kenya;Medium;NT $900/8 ounces;44;60;396.83;900;Kenya;Taoyuan, Taiwan;Taiwan;Kenya
Esmeralda Estate Panama Geisha;94;London, England;Boquete growing region, western Panama;;£45/10 capsules;0;0;;;Panama;London, England;United Kingdom;Panama
GW01 Finca Sophia Olympus Geisha;98;Yilan, Taiwan;Nueva Suiza, Chiriquí, Panama;Medium Light;NT $5,000/20 grams;58;76;25;;Panama;Yilan, Taiwan;Taiwan;Panama
La Esperanza Colombian Natural X.O.;94;Durango, Colorado;Valle de Cauca, Colombia;Medium Light;$16.95/12 ounces;54;70;4.98;16.95;Colombia;Durango, Colorado;USA;Colombia
Taiwan Geisha Honey;94;Minneapolis, Minnesota;Alishan, Taiwan;Light;$64.95/4 ounces;62;80;57.28;64.95;Taiwan;Minneapolis, Minnesota;USA;Taiwan
Camilina Geisha;95;San Diego, California;Piedra Candela, Chiriqui Province, western Panama;Medium Light;$85.00/6 ounces;60;78;49.97;85;Panama;San Diego, California;USA;Panama
Hacienda La Esmeralda Buenos Aires Geisha Natural;95;Topeka, Kansas;Jaramillo, Panama;Medium Light;$65.00/8 ounces;54;70;28.66;65;Panama;Topeka, Kansas;USA;Panama
Ethiopia Sidama Bona Washed G1;94;Hsinchu, Taiwan;Sidamo (also Sidama) growing region, south-central Ethiopia;Medium Light;$29.00/8 ounces;58;78;12.79;29;Ethiopia;Hsinchu, Taiwan;Taiwan;Ethiopia
Sidama Extreme Papilio Washed;94;Taichung City, Taiwan;Sidamo (also Sidama) growing region, south-central Ethiopia;Medium Light;$25.00/12 ounces;59;74;7.35;25;Ethiopia;Taichung, Taiwan;Taiwan;Ethiopia
Finca Santa Isabel;94;Antigua, Guatemala;Cobán growing region, Alta Verapaz, Guatemala;Medium Light;$13.00/12 ounces;55;73;3.82;13;Guatemala;Antigua, Guatemala;Guatemala;Guatemala
Finca San Carlos;94;Antigua, Guatemala;Antigua growing region, Guatemala;Medium Light;$13.00/12 ounces;56;72;3.82;13;Guatemala;Antigua, Guatemala;Guatemala;Guatemala
Ethiopia Natural Guji D Minor Special Lot;97;Chia-Yi, Taiwan;Guji Zone, Oromia Region, southern Ethiopia;Medium Light;NT $400/8 ounces;60;76;176.37;400;Ethiopia;Chia-Yi, Taiwan;Taiwan;Ethiopia
2020 Savage Auction Deborah Carbonic-Macerated Natural Geisha;94;Chia-Yi, Taiwan;Chiriqui, Boquete growing region, western Panama;Medium Light;NT $750/4 ounces;58;74;661.38;750;Panama;Chia-Yi, Taiwan;Taiwan;Panama
Costa Rica Cordillera del Fuego;94;Johns Creek, Georgia;Tarrazu, Costa Rica;Medium Light;$29.99/10 ounces;58;76;10.58;29.99;Rica;Johns Creek, Georgia;USA;Costa Rica
Ethiopia Bombe Mountains;94;Jersey City, New Jersey;Bombe mountains, Sidama Region, southern Ethiopia;Medium Light;$25.00/12 ounces;58;76;7.35;25;Ethiopia;Jersey, New Jersey;USA;Ethiopia
Ethiopia Yirgacheffe G1 Natural Asfaw Maru;94;Bozeman, Montana;Yirgacheffe growing region, southern Ethiopia;Medium Light;$16.95/12 ounces;52;70;4.98;16.95;Ethiopia;Bozeman, Montana;USA;Ethiopia
Coffea Diversa Rume Sudan Winey;95;Minneapolis, Minnesota;Suchitan, Guatemala;Light;$19.95/4 ounces;64;84;17.59;19.95;Guatemala;Minneapolis, Minnesota;USA;Guatemala
Hawai’i Puna Anaerobic Washed;94;Minneapolis, Minnesota;Puna growing region, Big Island of Hawai’i;Medium Light;$19.95/4 ounces;58;76;17.59;19.95;;Minneapolis, Minnesota;USA;
Colombia Hacienda Casablanca;94;Toronto, Ontario, Canada;Cundinamarca, Colombia;Medium Light;US $20.00/12 ounces;62;78;5.88;;Colombia;Toronto, Canada;Canada;Colombia
Ethiopia Natural Guji Kercha Lot Riverside;94;Chia-Yi, Taiwan;Guji Zone, Oromia Region, southern Ethiopia;Medium Light;NT $275/8 ounces;58;78;121.25;275;Ethiopia;Chia-Yi, Taiwan;Taiwan;Ethiopia
Costa Rica Yellow Honey Lot Kinka Bear;94;Chia-Yi, Taiwan;Costa Rica;Medium Light;NT $250/8 ounces;52;70;110.23;250;Rica;Chia-Yi, Taiwan;Taiwan;Costa Rica
San Diego Natural;95;Madison, Wisconsin;Tarrazu, Costa Rica;Medium Light;$17.90/12 ounces;55;75;5.26;45917;Rica;Madison, Wisconsin;USA;Costa Rica
Buna Boka #1;94;Madison, Wisconsin;idamo (also Sidama) growing region, south-central Ethiopia;Medium Light;$18.75/12 ounces;60;78;5.51;18.75;Ethiopia;Madison, Wisconsin;USA;Ethiopia
El Jardin;94;Madison, Wisconsin;Antioquia, Colombia;Medium Light;$28.00/8 ounces;58;74;12.35;28;Colombia;Madison, Wisconsin;USA;Colombia
Kenya Wachuri;95;San Rafael, California;Nyeri growing region, south-central Kenya;Medium;$22.00/12 ounces;48;66;6.47;22;Kenya;San Rafael, California;USA;Kenya
Kenya Baragwi Guama AB;95;Bedford, New Hampshire;Kirinyaga District, south-central Kenya;Medium Light;$17.00/12 ounces;60;80;5;17;Kenya;Bedford, New Hampshire;USA;Kenya
Kenya ARES;95;Taipei, Taiwan;Nyeri growing region, south-central Kenya;Medium Light;NT $380/115 grams;54;74;330.43;13.40388007;Kenya;Taipei, Taiwan;Taiwan;Kenya
Empress Kenya;95;Taipei, Taiwan;Kiambu growing region, south-central Kenya;Medium Light;NT $550/225 grams;58;74;244.44;19.40035273;Kenya;Taipei, Taiwan;Taiwan;Kenya
Kenya Kiambu AB Top Lot;94;Chia-Yi, Taiwan;Kiambu growing region, south-central Kenya;Medium Light;NT $450/227 grams;54;72;198.24;15.87301587;Kenya;Chia-Yi, Taiwan;Taiwan;Kenya
Kenya Kiambu Maua Lot AB;94;Chia-Yi, Taiwan;Kiambu growing region, south-central Kenya;Medium Light;NT $325/8 ounces;60;78;143.3;325;Kenya;Chia-Yi, Taiwan;Taiwan;Kenya
Kenya Thunguri AA;94;Los Angeles, California;Kirinyaga District, south-central Kenya;Medium Light;$21.95/12 ounces;58;80;6.45;21.95;Kenya;Los Angeles, California;USA;Kenya
Kenya Kirinyaga Kabare Karani AA;94;Toronto, Ontario, Canada;Kirinyaga District, south-central Kenya;Medium Light;CAD $22.00/225 grams;60;78;9.78;;Kenya;Toronto, Canada;Canada;Kenya
Kenya Kirinyaga Kii;94;Yilan, Taiwan;Kirinyaga District, south-central Kenya;Medium Light;NT $500/200 grams;57;77;250;17.6366843;Kenya;Yilan, Taiwan;Taiwan;Kenya
Kenya Rungeto;94;Carlsbad, California;Kirinyaga District, south-central Kenya;Medium Light;$23.00/12 ounces;56;72;6.76;23;Kenya;Carlsbad, California;USA;Kenya
Kenya AA Top Gatomboya;94;Martinez, California;Nyeri growing region, south-central Kenya;Medium Light;$12.00/8 ounces;54;72;5.29;12;Kenya;Martinez, California;USA;Kenya
Heart & Soul Espresso Blend;94;Martinez, California;Guatemala, Ethiopia;Medium;$12.00/8 ounces;50;70;5.29;12;Ethiopia;Martinez, California;USA;Ethiopia
